{
  "$schema": "./brand.schema.json",
  "meta": {
    "name": "TuMarca",
    "slug": "tumarca",
    "version": "1.1.0",
    "owner": "Equipo de Contenido",
    "updated": "2026-10-19",
    "notes": "Marca placeholder. Reemplazá cada valor por el de tu manual de marca y corré `npm run brand`."
  },
  "identity": {
    "tagline": "Tecnología explicada con claridad",
    "mission": "Hacer que conceptos técnicos complejos se entiendan en minutos, sin perder rigor.",
    "audience": "Profesionales de tecnología y tomadores de decisión (25-45 años), consumo mobile-first en LinkedIn, YouTube y Reels.",
    "personality": [
      "preciso",
      "optimista",
      "técnico pero humano",
      "sin exageraciones"
    ],
    "voice": {
      "language": "es-AR",
      "register": "vos",
      "tone": "Directo, didáctico y concreto. Cada afirmación técnica tiene que poder verificarse.",
      "do": [
        "Una idea por pantalla",
        "Verbos concretos y números verificados",
        "Analogías simples antes del detalle técnico"
      ],
      "dont": [
        "Hype vacío (\"revolucionario\", \"increíble\", \"game changer\")",
        "Jerga sin explicar",
        "Claims de rendimiento sin fuente"
      ]
    }
  },
  "colors": {
    "background": "#0B0F19",
    "surface": "#131A2A",
    "surfaceAlt": "#1B2438",
    "border": "#2A3550",
    "text": "#F4F6FB",
    "textMuted": "#A6B0C5",
    "primary": "#4C8DFF",
    "secondary": "#2ED3A7",
    "accent": "#FFB547",
    "danger": "#FF6B6B",
    "success": "#3DDC84",
    "onPrimary": "#06101F",
    "code": {
      "background": "#0E1422",
      "text": "#E6EDF7",
      "comment": "#94A0B8",
      "keyword": "#7FB0FF",
      "string": "#5FE0B8",
      "number": "#FFC46B",
      "function": "#C9A7FF"
    },
    "dataViz": [
      "#4C8DFF",
      "#2ED3A7",
      "#FFB547",
      "#C9A7FF",
      "#FF6B6B",
      "#8A96B0"
    ],
    "gradients": {
      "hero": [
        "#4C8DFF",
        "#2ED3A7"
      ]
    },
    "rules": {
      "maxAccentMomentsPerFrame": 1,
      "notes": "El acento (accent) se raciona: una sola vez por frame, para el dato o la palabra clave. Nunca para texto corrido."
    }
  },
  "typography": {
    "display": {
      "family": "Space Grotesk",
      "fallback": "ui-sans-serif, system-ui, sans-serif",
      "weights": [
        500,
        700
      ],
      "source": "fontsource",
      "package": "@fontsource/space-grotesk",
      "license": "OFL-1.1",
      "tracking": "-0.025em",
      "lineHeight": 1.02,
      "case": "sentence"
    },
    "body": {
      "family": "Inter",
      "fallback": "ui-sans-serif, system-ui, sans-serif",
      "weights": [
        400,
        500,
        600,
        700
      ],
      "source": "fontsource",
      "package": "@fontsource/inter",
      "license": "OFL-1.1",
      "tracking": "-0.01em",
      "lineHeight": 1.3,
      "case": "sentence"
    },
    "mono": {
      "family": "JetBrains Mono",
      "fallback": "ui-monospace, monospace",
      "weights": [
        400,
        500
      ],
      "source": "fontsource",
      "package": "@fontsource/jetbrains-mono",
      "license": "OFL-1.1",
      "tracking": "0",
      "lineHeight": 1.5,
      "case": "as-is"
    },
    "scale": {
      "unit": "cqmin",
      "comment": "Tamaños en % del lado corto del frame (1cqmin = 10.8px en 1080p). Funciona igual en 16:9, 9:16 y 1:1.",
      "hero": 13,
      "h1": 9,
      "h2": 6.4,
      "h3": 4.8,
      "body": 3.7,
      "caption": 3.3,
      "label": 2.6,
      "code": 3.0,
      "portraitMultiplier": 1.22,
      "feedMultiplier": 1.1
    },
    "rules": {
      "maxWordsPerLine": 7,
      "maxLinesPerFrame": 3,
      "minSizePx1080": 28,
      "kickerUppercase": true
    }
  },
  "logo": {
    "primary": "brand/logo/logo.svg",
    "mark": "brand/logo/mark.svg",
    "onDark": "brand/logo/logo.svg",
    "onLight": "brand/logo/logo-dark.svg",
    "clearSpaceRatio": 0.5,
    "minHeightPx1080": 40,
    "watermark": {
      "enabled": false,
      "position": "bottom-right",
      "opacity": 0.6
    },
    "sting": {
      "style": "mark-scale-then-wordmark-reveal",
      "durationMs": 2200
    },
    "dont": [
      "deformar",
      "rotar",
      "cambiar colores fuera de la paleta",
      "efectos glow o bevel"
    ]
  },
  "motion": {
    "personality": "productive",
    "personalityOptions": "productive = preciso y sobrio (B2B, tech) | balanced | expressive = enérgico (social, lanzamientos)",
    "principles": [
      "El movimiento explica: cada animación responde a una pregunta (qué apareció, qué cambió, qué importa).",
      "Una cosa a la vez: el ojo sigue un solo foco por beat; el resto queda quieto.",
      "Nunca arrancar en t=0: primer movimiento a los 150-300 ms de iniciada la escena.",
      "Entradas decididas, salidas discretas: las salidas duran ~65% de las entradas y aceleran.",
      "Holds generosos: el texto queda en pantalla al menos max(1,5 s; 0,8 s + 0,35 s por palabra; caracteres / 15).",
      "Dirección consistente: lo nuevo entra de derecha/abajo, lo que se va sale a izquierda/arriba.",
      "Máximo 2 tweens con el mismo easing por escena; la escena más lenta dura ~3x la más rápida."
    ],
    "durations": {
      "instant": 100,
      "micro": 150,
      "short": 250,
      "enter": 500,
      "exit": 325,
      "emphasis": 800,
      "scene": 400,
      "long": 1200
    },
    "easings": {
      "standard": [
        0.2,
        0,
        0,
        1
      ],
      "enter": [
        0.165,
        0.84,
        0.44,
        1
      ],
      "exit": [
        0.55,
        0.055,
        0.675,
        0.19
      ],
      "emphasized": [
        0.19,
        1,
        0.22,
        1
      ],
      "move": [
        0.645,
        0.045,
        0.355,
        1
      ],
      "camera": [
        0.77,
        0,
        0.175,
        1
      ],
      "linear": [
        0,
        0,
        1,
        1
      ],
      "expressive": [
        0.34,
        1.56,
        0.64,
        1
      ]
    },
    "stagger": {
      "letters": 25,
      "words": 70,
      "lines": 120,
      "items": 60
    },
    "staggerGroupMaxMs": 500,
    "staggerComment": "Un grupo escalonado no supera staggerGroupMaxMs: BRAND.stagger(nombre, n) devuelve min(valor, staggerGroupMaxMs / n).",
    "distance": {
      "small": 1.5,
      "medium": 4,
      "large": 10,
      "unit": "cqmin"
    },
    "reading": {
      "secondsPerWord": 0.35,
      "baseMs": 800,
      "minHoldMs": 1500,
      "charsPerSecond": 15,
      "comment": "hold = max(minHold; base + 0,35 s × palabras; caracteres / 15). Sumá +20 % si el texto es técnico (código, cifras, nombres propios)."
    },
    "transitions": {
      "default": "cut",
      "allowed": [
        "cut",
        "crossfade",
        "push",
        "mask-wipe"
      ],
      "comment": "Solo las transiciones implementadas en build:roots. Una transición fuera de esta lista hace fallar el build (nunca cae a corte en silencio).",
      "manualInNLE": [
        "zoom-through",
        "match-cut"
      ],
      "manualComment": "Permitidas por la marca pero no automatizadas: se resuelven en el editor (NLE) o como escena custom.",
      "forbidden": [
        "spin",
        "star-wipe",
        "glitch aleatorio",
        "page-curl",
        "flash blanco > 3 por segundo"
      ]
    },
    "forbidden": [
      "Bounce/elastic en texto",
      "Todo entrando a la vez con el mismo fade+slide-up",
      "Rotaciones decorativas sin significado",
      "Glow, partículas o lens flares de relleno",
      "Movimiento continuo detrás de texto que se está leyendo"
    ],
    "easingNotes": {
      "standard": "Reposicionar algo visible (Material 3 standard)",
      "enter": "Entrada por defecto, desacelera sin rebote (= GSAP power3.out)",
      "exit": "Salida por defecto, acelera (= power2.in)",
      "emphasized": "Hero, reveals con máscara, el dato clave (= expo.out)",
      "move": "Movimientos simétricos y push entre escenas (= power2.inOut)",
      "camera": "Zoom/paneo de cámara virtual (= power3.inOut), 1-2 s",
      "linear": "Tipeo, progreso, scroll constante",
      "expressive": "RESTRINGIDO: overshoot ~10%. Solo registro lúdico aprobado; nunca datos, logos ni texto"
    }
  },
  "layout": {
    "safeMarginPct": {
      "landscape": 6,
      "portrait": 8,
      "square": 7,
      "feed": 7
    },
    "platformSafeZones": {
      "universal-9x16": {
        "topPct": 14,
        "bottomPct": 35,
        "rightPct": 14,
        "leftPct": 6,
        "comment": "Peor caso combinado Reels/TikTok/Shorts. Usar por defecto si la pieza va a varias plataformas."
      },
      "shorts-9x16": {
        "topPct": 12,
        "bottomPct": 22,
        "rightPct": 14,
        "leftPct": 6
      },
      "reels-9x16": {
        "topPct": 14,
        "bottomPct": 35,
        "rightPct": 12,
        "leftPct": 6
      },
      "tiktok-9x16": {
        "topPct": 12,
        "bottomPct": 30,
        "rightPct": 16,
        "leftPct": 6
      }
    },
    "radius": {
      "sm": 0.8,
      "md": 1.5,
      "lg": 2.5,
      "unit": "cqmin"
    },
    "stroke": 0.25,
    "grid": {
      "columns": 12,
      "gutter": 2
    },
    "background": {
      "style": "subtle-grid",
      "options": "solid | subtle-grid | gradient-glow",
      "gridOpacity": 0.06
    }
  },
  "formats": [
    {
      "id": "landscape",
      "label": "YouTube / web 16:9",
      "width": 1920,
      "height": 1080,
      "fps": 30
    },
    {
      "id": "portrait",
      "label": "Shorts / Reels / TikTok 9:16",
      "width": 1080,
      "height": 1920,
      "fps": 30,
      "safeZone": "universal-9x16"
    },
    {
      "id": "feed",
      "label": "Feed 4:5 (LinkedIn / Instagram)",
      "width": 1080,
      "height": 1350,
      "fps": 30
    },
    {
      "id": "square",
      "label": "Feed 1:1",
      "width": 1080,
      "height": 1080,
      "fps": 30
    }
  ],